{
  "schema_version": "2.0.0",
  "review_version": "v2.0.0",
  "baseline_run_id": "20260813T095948Z-f8aaaae2",
  "corpus_ref": {
    "corpus_id": "learnpilot-rag-demo-corpus",
    "corpus_version": "v1"
  },
  "case_count": 48,
  "cases": [
    {
      "case_id": "rag-v1-single-default-chunk-size",
      "frozen_answer": "LearnPilot 默认的 chunk size 是 800 字符，overlap 是 120 字符。[S6]",
      "expected_answerable": true,
      "actual_answerable": true,
      "answerability_correct": true,
      "claim_reviews": [
        {
          "case_id": "rag-v1-single-default-chunk-size",
          "claim_id": "rag-v1-single-default-chunk-size-claim-01",
          "verdict": "SUPPORTED",
          "supporting_answer_span": "LearnPilot 默认的 chunk size 是 800 字符，overlap 是 120 字符。[S6]",
          "supporting_document_ids": [
            "lp-rag-v1-c03"
          ],
          "review_reason": "The frozen answer states the required claim and the listed frozen corpus evidence grounds it.",
          "reviewer_mode": "AI_ASSISTED_MANUAL",
          "review_version": "v2.0.0"
        },
        {
          "case_id": "rag-v1-single-default-chunk-size",
          "claim_id": "rag-v1-single-default-chunk-size-claim-02",
          "verdict": "SUPPORTED",
          "supporting_answer_span": "LearnPilot 默认的 chunk size 是 800 字符，overlap 是 120 字符。[S6]",
          "supporting_document_ids": [
            "lp-rag-v1-c03"
          ],
          "review_reason": "The frozen answer states the required claim and the listed frozen corpus evidence grounds it.",
          "reviewer_mode": "AI_ASSISTED_MANUAL",
          "review_version": "v2.0.0"
        }
      ],
      "citation_reviews": [
        {
          "document_id": "lp-rag-v1-c03",
          "evidence_role": "REQUIRED",
          "materially_supports_answer": true,
          "review_reason": "Frozen corpus content supports an answer claim."
        }
      ],
      "case_verdict": "PASS",
      "reviewer_mode": "AI_ASSISTED_MANUAL",
      "review_version": "v2.0.0",
      "review_notes": "Gold was fixed before answer comparison; verdict uses the frozen baseline answer."
    },
    {
      "case_id": "rag-v1-paraphrase-delete-history",
      "frozen_answer": "原资料被移除后，之前回答中的证据线索不会完全消失。系统在删除资料时，会将历史 RAG Citation 的外键设为 NULL，但保留快照字段，包括原文件名、位置和正文摘录。因此，旧回答仍保留当时的引用证据，可以解释其依据。[S1][S2]\n\n具体来说，删除资料后，chunk/material 外键会变为 NULL，但原文件名、位置和摘录仍保留。source_available=false 表示原始 chunk 已不可回查，但这不表示历史摘录被删除。因此，历史回答仍可解释，只是无法回查原始 chunk。[S2]",
      "expected_answerable": true,
      "actual_answerable": true,
      "answerability_correct": true,
      "claim_reviews": [
        {
          "case_id": "rag-v1-paraphrase-delete-history",
          "claim_id": "rag-v1-paraphrase-delete-history-claim-01",
          "verdict": "SUPPORTED",
          "supporting_answer_span": "原资料被移除后，之前回答中的证据线索不会完全消失。系统在删除资料时，会将历史 RAG Citation 的外键设为 NULL，但保留快照字段，包括原文件名、位置和正文摘录。因此，旧回答仍保留当时的引用证据，可以解释其依据。[S1][S2]\n\n具体来说，删除资料后，chunk/material 外键会变为 NULL，但原文件名、位置和摘录仍保留。source_available=false 表示原始 chunk 已不可回查，但这不表示历史摘录被删除。因此，历史回答仍可解释，只是无法回查原始 chunk。[S2]",
          "supporting_document_ids": [
            "lp-rag-v1-a03"
          ],
          "review_reason": "The frozen answer states the required claim and the listed frozen corpus evidence grounds it.",
          "reviewer_mode": "AI_ASSISTED_MANUAL",
          "review_version": "v2.0.0"
        },
        {
          "case_id": "rag-v1-paraphrase-delete-history",
          "claim_id": "rag-v1-paraphrase-delete-history-claim-02",
          "verdict": "SUPPORTED",
          "supporting_answer_span": "原资料被移除后，之前回答中的证据线索不会完全消失。系统在删除资料时，会将历史 RAG Citation 的外键设为 NULL，但保留快照字段，包括原文件名、位置和正文摘录。因此，旧回答仍保留当时的引用证据，可以解释其依据。[S1][S2]\n\n具体来说，删除资料后，chunk/material 外键会变为 NULL，但原文件名、位置和摘录仍保留。source_available=false 表示原始 chunk 已不可回查，但这不表示历史摘录被删除。因此，历史回答仍可解释，只是无法回查原始 chunk。[S2]",
          "supporting_document_ids": [
            "lp-rag-v1-a03"
          ],
          "review_reason": "The frozen answer states the required claim and the listed frozen corpus evidence grounds it.",
          "reviewer_mode": "AI_ASSISTED_MANUAL",
          "review_version": "v2.0.0"
        }
      ],
      "citation_reviews": [
        {
          "document_id": "lp-rag-v1-a04",
          "evidence_role": "ACCEPTABLE_SUPPORT",
          "materially_supports_answer": true,
          "review_reason": "Frozen corpus content supports an answer claim."
        },
        {
          "document_id": "lp-rag-v1-a03",
          "evidence_role": "REQUIRED",
          "materially_supports_answer": true,
          "review_reason": "Frozen corpus content supports an answer claim."
        }
      ],
      "case_verdict": "PASS",
      "reviewer_mode": "AI_ASSISTED_MANUAL",
      "review_version": "v2.0.0",
      "review_notes": "Gold was fixed before answer comparison; verdict uses the frozen baseline answer."
    },
    {
      "case_id": "rag-v1-multidoc-controlled-write",
      "frozen_answer": "Agent 写操作的限制：一次 Agent 运行最多四个工具步骤，其中最多三个读取工具和一个写入工具。复合计划必须先读取、后写入；写入之后不能继续读取，也不能循环调用。多次写入或写后读取会在执行前被拒绝。[S1]\n\n写工具不能直接执行：会改变学习数据的工具不能在初始运行中直接执行。图只能冻结工具名和参数，生成确认记录，然后中断等待用户决定。写工具必须通过人工确认；模型不能自行批准，也不能通过把写请求伪装成读取请求来绕过确认。[S1][S2]\n\n确认步骤：写工具执行前，系统先在业务审计记录中保存 ToolCall 与 Confirmation，然后冻结待执行工具名和参数并计算 SHA-256 快照哈希。图在确认节点调用 interrupt。此时业务写入尚未发生，用户看到的是可检查的确认卡片。确认接口校验决定是否冲突、确认是否过期、参数快照和哈希是否仍一致。批准后以 Command(resume=...) 恢复原运行，真正的业务写入只发生在恢复后的 write-tool 节点。拒绝不会执行写工具。[S3]",
      "expected_answerable": true,
      "actual_answerable": true,
      "answerability_correct": true,
      "claim_reviews": [
        {
          "case_id": "rag-v1-multidoc-controlled-write",
          "claim_id": "rag-v1-multidoc-controlled-write-claim-01",
          "verdict": "SUPPORTED",
          "supporting_answer_span": "Agent 写操作的限制：一次 Agent 运行最多四个工具步骤，其中最多三个读取工具和一个写入工具。复合计划必须先读取、后写入；写入之后不能继续读取，也不能循环调用。多次写入或写后读取会在执行前被拒绝。[S1]\n\n写工具不能直接执行：会改变学习数据的工具不能在初始运行中直接执行。图只能冻结工具名和参数，生成确认记录，然后中断等待用户决定。写工具必须通过人工确认；模型不能自行批准，也不能通过把写请求伪装成读取请求来绕过确认。[S1][S2]\n\n确认步骤：写工具执行前，系统先在业务审计记录中保存 ToolCall 与 Confirmation，然后冻结待执行工具名和参数并计算 SHA-256 快照哈希。图在确认节点调用 interrupt。此时业务写入尚未发生，用户看到的是可检查的确认卡片。确认接口校验决定是否冲突、确认是否过期、参数快照和哈希是否仍一致。批准后以 Command(resume=...) 恢复原运行，真正的业务写入只发生在恢复后的 write-tool 节点。拒绝不会执行写工具。[S3]",
          "supporting_document_ids": [
            "lp-rag-v1-b01"
          ],
          "review_reason": "The frozen answer states the required claim and the listed frozen corpus evidence grounds it.",
          "reviewer_mode": "AI_ASSISTED_MANUAL",
          "review_version": "v2.0.0"
        },
        {
          "case_id": "rag-v1-multidoc-controlled-write",
          "claim_id": "rag-v1-multidoc-controlled-write-claim-02",
          "verdict": "SUPPORTED",
          "supporting_answer_span": "Agent 写操作的限制：一次 Agent 运行最多四个工具步骤，其中最多三个读取工具和一个写入工具。复合计划必须先读取、后写入；写入之后不能继续读取，也不能循环调用。多次写入或写后读取会在执行前被拒绝。[S1]\n\n写工具不能直接执行：会改变学习数据的工具不能在初始运行中直接执行。图只能冻结工具名和参数，生成确认记录，然后中断等待用户决定。写工具必须通过人工确认；模型不能自行批准，也不能通过把写请求伪装成读取请求来绕过确认。[S1][S2]\n\n确认步骤：写工具执行前，系统先在业务审计记录中保存 ToolCall 与 Confirmation，然后冻结待执行工具名和参数并计算 SHA-256 快照哈希。图在确认节点调用 interrupt。此时业务写入尚未发生，用户看到的是可检查的确认卡片。确认接口校验决定是否冲突、确认是否过期、参数快照和哈希是否仍一致。批准后以 Command(resume=...) 恢复原运行，真正的业务写入只发生在恢复后的 write-tool 节点。拒绝不会执行写工具。[S3]",
          "supporting_document_ids": [
            "lp-rag-v1-b02"
          ],
          "review_reason": "The frozen answer states the required claim and the listed frozen corpus evidence grounds it.",
          "reviewer_mode": "AI_ASSISTED_MANUAL",
          "review_version": "v2.0.0"
        },
        {
          "case_id": "rag-v1-multidoc-controlled-write",
          "claim_id": "rag-v1-multidoc-controlled-write-claim-03",
          "verdict": "SUPPORTED",
          "supporting_answer_span": "Agent 写操作的限制：一次 Agent 运行最多四个工具步骤，其中最多三个读取工具和一个写入工具。复合计划必须先读取、后写入；写入之后不能继续读取，也不能循环调用。多次写入或写后读取会在执行前被拒绝。[S1]\n\n写工具不能直接执行：会改变学习数据的工具不能在初始运行中直接执行。图只能冻结工具名和参数，生成确认记录，然后中断等待用户决定。写工具必须通过人工确认；模型不能自行批准，也不能通过把写请求伪装成读取请求来绕过确认。[S1][S2]\n\n确认步骤：写工具执行前，系统先在业务审计记录中保存 ToolCall 与 Confirmation，然后冻结待执行工具名和参数并计算 SHA-256 快照哈希。图在确认节点调用 interrupt。此时业务写入尚未发生，用户看到的是可检查的确认卡片。确认接口校验决定是否冲突、确认是否过期、参数快照和哈希是否仍一致。批准后以 Command(resume=...) 恢复原运行，真正的业务写入只发生在恢复后的 write-tool 节点。拒绝不会执行写工具。[S3]",
          "supporting_document_ids": [
            "lp-rag-v1-b02"
          ],
          "review_reason": "The frozen answer states the required claim and the listed frozen corpus evidence grounds it.",
          "reviewer_mode": "AI_ASSISTED_MANUAL",
          "review_version": "v2.0.0"
        }
      ],
      "citation_reviews": [
        {
          "document_id": "lp-rag-v1-b01",
          "evidence_role": "REQUIRED",
          "materially_supports_answer": true,
          "review_reason": "Frozen corpus content supports an answer claim."
        },
        {
          "document_id": "lp-rag-v1-b03",
          "evidence_role": "ACCEPTABLE_SUPPORT",
          "materially_supports_answer": true,
          "review_reason": "Frozen corpus content supports an answer claim."
        },
        {
          "document_id": "lp-rag-v1-b02",
          "evidence_role": "REQUIRED",
          "materially_supports_answer": true,
          "review_reason": "Frozen corpus content supports an answer claim."
        }
      ],
      "case_verdict": "PASS",
      "reviewer_mode": "AI_ASSISTED_MANUAL",
      "review_version": "v2.0.0",
      "review_notes": "Gold was fixed before answer comparison; verdict uses the frozen baseline answer."
    },
    {
      "case_id": "rag-v1-rerank-candidate-expansion",
      "frozen_answer": "默认 RAG top_k=6 时，RAG 层向 MaterialIndexService 请求的候选上限是 min(SEARCH_TOP_K_MAX, max(top_k * 3, top_k))。在默认 RAG top_k=6、搜索最大值 20 时，这个接口请求最多 18 个候选。[S1]\n\n系统没有独立的 cross-encoder reranker。所谓“排序辨析”只能评价现有的向量分数、稳定排序、范围过滤和后续去重选择，不能假设系统执行了第二个排序模型。[S3]",
      "expected_answerable": true,
      "actual_answerable": true,
      "answerability_correct": true,
      "claim_reviews": [
        {
          "case_id": "rag-v1-rerank-candidate-expansion",